{
  "analysis_mode": "elite_300",
  "token_efficiency_mode": "elite_300",
  "token_budget_level": "high",
  "should_use_elite_mode": true,
  "elite_mode_reason": "weekly_report_uses_aggregated_campaign_analysis",
  "estimated_token_cost_level": "high",
  "data_loading_strategy": "aggregated_summary",
  "large_context_allowed": true,
  "week_start": "2026-05-23",
  "week_end": "2026-05-29",
  "total_leads_contacted": 1,
  "reply_rate": 1.0,
  "demo_click_rate": 0.0,
  "whatsapp_test_rate": 0.0,
  "meeting_rate": 0.0,
  "close_rate": 0.0,
  "best_opening": "google_no_website_v1",
  "worst_opening": "google_no_website_v1",
  "best_lead_type": "website_seo:none",
  "worst_lead_type": "website_seo:none",
  "top_objections": [
    {
      "name": "source",
      "count": 1
    }
  ],
  "lost_reasons": [],
  "recommended_next_strategy": "Priorizar resposta para objecao 'source' na proxima semana.",
  "stop_doing": [
    "Repetir mensagem parecida depois de resposta real.",
    "Prometer resultado comercial garantido."
  ],
  "continue_doing": [
    "Responder perguntas diretas antes do pitch.",
    "Separar oferta por status do site."
  ],
  "test_next": [
    "A/B testar abertura com responsavel versus permissao para resumo curto.",
    "Comparar website_seo contra audit em sites fracos."
  ],
  "generated_at": "2026-05-29T06:09:31Z"
}
